{
  "$schema": "https://json-schema.org/draft/2020-12/schema",
  "$id": "semgraph:kpiStatus/request",
  "title": "kpiStatus request",
  "description": "Where a cumulative KPI stands against its target: the real level per period, and the path to the target that was set at planning and never moves. The warehouse delivers both as levels at the end of each period (REQ-069); the chart takes the differences: what each period added, the shortfall against the path, the catch-up in the next period and the pace after it.",
  "type": "object",
  "additionalProperties": false,
  "required": [
    "semgraph",
    "metric",
    "measureType",
    "unit",
    "start",
    "target",
    "pathSet",
    "points"
  ],
  "properties": {
    "semgraph": {
      "const": "kpiStatus"
    },
    "metric": {
      "description": "Identifier of the metric, e.g. creditLeads. Used as title when no title is given.",
      "type": "string",
      "pattern": "^[A-Za-z][A-Za-z0-9_]{0,63}$"
    },
    "title": {
      "description": "Title above the chart. States what is shown, not a conclusion.",
      "type": "string",
      "minLength": 1,
      "maxLength": 120
    },
    "measureType": {
      "description": "Kind of number: additive or unique for a count; perUnit for a mean or median per unit where the spread between the units is the question, such as an amount per lead (REQ-070, REQ-074); ratio for a numerator divided by a denominator, only in movingWindowRatio and calendarRatio (REQ-074, REQ-076). Required until Domain Hub or the dbt YAML supplies it.",
      "enum": [
        "additive",
        "unique",
        "perUnit",
        "ratio"
      ]
    },
    "uniqueAggregation": {
      "description": "Required for unique counts: daily (the uniques per day; never summed) or overPeriod (the uniques over the whole block, counted in the warehouse; only as a total).",
      "enum": [
        "daily",
        "overPeriod"
      ]
    },
    "unit": {
      "description": "The periods of the path: week (ISO), month or quarter.",
      "enum": [
        "week",
        "month",
        "quarter"
      ]
    },
    "start": {
      "description": "Where the KPI counts from: its first day and the level on it.",
      "type": "object",
      "additionalProperties": false,
      "required": [
        "day",
        "value"
      ],
      "properties": {
        "day": {
          "description": "The day of the start.",
          "type": "string",
          "pattern": "^[0-9]{4}-[0-9]{2}-[0-9]{2}$"
        },
        "value": {
          "description": "The level at the start.",
          "type": "number",
          "minimum": 0
        }
      }
    },
    "target": {
      "description": "The level to reach, and the last day to reach it.",
      "type": "object",
      "additionalProperties": false,
      "required": [
        "day",
        "value"
      ],
      "properties": {
        "day": {
          "description": "The day of the target.",
          "type": "string",
          "pattern": "^[0-9]{4}-[0-9]{2}-[0-9]{2}$"
        },
        "value": {
          "description": "The level at the target.",
          "type": "number",
          "minimum": 0
        }
      }
    },
    "pathSet": {
      "description": "The day the path was set. It never moves afterwards: a path that is redrawn every month can never be missed.",
      "type": "string",
      "pattern": "^[0-9]{4}-[0-9]{2}-[0-9]{2}$"
    },
    "asOf": {
      "description": "The last complete day of the data. Yesterday in Brussels when absent.",
      "type": "string",
      "pattern": "^[0-9]{4}-[0-9]{2}-[0-9]{2}$"
    },
    "size": {
      "description": "The size of the chart (REQ-085): card (360 px wide, next to a KPI tile), default (640 px), large (1280 px, a 16:9 slide) or xl (1920 px, a big screen or print). Only the width is chosen; the height follows from the content. The chart is built anew in every size, so everything written on it fits.",
      "enum": [
        "card",
        "default",
        "large",
        "xl"
      ],
      "default": "default"
    },
    "format": {
      "description": "Output format. Only svg is available in v0.",
      "enum": [
        "svg",
        "png",
        "html",
        "widget"
      ],
      "default": "svg"
    },
    "locale": {
      "description": "Language of titles, labels and messages, e.g. en or nl-BE. Unknown locales fall back to English.",
      "type": "string",
      "pattern": "^[A-Za-z]{2,3}(-[A-Za-z0-9]{2,8})*$"
    },
    "context": {
      "description": "Provenance and status for the footer. Missing values are shown as unknown.",
      "type": "object",
      "additionalProperties": false,
      "properties": {
        "domain": {
          "type": "string",
          "minLength": 1,
          "maxLength": 80
        },
        "dataset": {
          "type": "string",
          "minLength": 1,
          "maxLength": 80
        },
        "owner": {
          "type": "string",
          "minLength": 1,
          "maxLength": 80
        },
        "reliability": {
          "type": "string",
          "minLength": 1,
          "maxLength": 80
        },
        "definitionUrl": {
          "type": "string",
          "minLength": 1,
          "maxLength": 500
        }
      }
    },
    "meta": {
      "description": "Metadata of the chart (REQ-010): the question that started it, references, the query, who asked and who built it, and the day it was compiled. Only what is given is shown (REQ-020).",
      "type": "object",
      "additionalProperties": false,
      "properties": {
        "question": {
          "description": "The question that started the chart.",
          "type": "string",
          "minLength": 1,
          "maxLength": 1000
        },
        "askedBy": {
          "description": "Who asked the question.",
          "type": "string",
          "minLength": 1,
          "maxLength": 80
        },
        "builtBy": {
          "description": "Who built the chart.",
          "type": "string",
          "minLength": 1,
          "maxLength": 80
        },
        "references": {
          "description": "Links to Jira, Slack or anything else.",
          "type": "array",
          "minItems": 1,
          "maxItems": 10,
          "items": {
            "type": "object",
            "additionalProperties": false,
            "required": [
              "url"
            ],
            "properties": {
              "label": {
                "type": "string",
                "minLength": 1,
                "maxLength": 120
              },
              "url": {
                "type": "string",
                "minLength": 1,
                "maxLength": 500
              }
            }
          }
        },
        "query": {
          "description": "The query behind the data, shown as written.",
          "type": "string",
          "minLength": 1,
          "maxLength": 10000
        },
        "compiledOn": {
          "description": "The day the chart was compiled. When absent, the day it is drawn, in Brussels.",
          "type": "string",
          "pattern": "^[0-9]{4}-[0-9]{2}-[0-9]{2}$"
        }
      }
    },
    "points": {
      "description": "One row per period, from the period with the start to the one with the target, computed in the warehouse (REQ-069).",
      "type": "array",
      "minItems": 1,
      "maxItems": 120,
      "items": {
        "type": "object",
        "additionalProperties": false,
        "required": [
          "period"
        ],
        "properties": {
          "period": {
            "description": "The ISO name of the period: 2026-W40, 2026-09 or 2026-Q3.",
            "type": "string",
            "pattern": "^[0-9]{4}(-W[0-9]{2}|-[0-9]{2}|-Q[1-4])$"
          },
          "actual": {
            "description": "The real level since the start at the end of the period; only for periods that are over. Leave out or null for the future.",
            "type": [
              "number",
              "null"
            ],
            "minimum": 0
          },
          "path": {
            "description": "The planned level at the end of the period, from the period in which the path was set up to the target.",
            "type": [
              "number",
              "null"
            ],
            "minimum": 0
          }
        }
      }
    }
  }
}
